{
  "$schema": "./translation-schema.json",
  "authentication": {
    "newAccountCreated": "Un nuovo account è appena stato creato per te per accedere a <a href=\"{{serverURL}}\">{{serverURL}}</a> Clicca sul seguente link o incolla l'URL qui sotto nel browser per verificare la tua email: <a href=\"{{verificationURL}}\">{{verificationURL}}</a><br> Dopo aver verificato la tua email, sarai in grado di effettuare il log in con successo.",
    "resetYourPassword": "Modifica la tua Password",
    "verifyYourEmail": "Verifica la tua email",
    "youAreReceivingResetPassword": "Ricevi questo messaggio perché tu (o qualcun altro) hai richiesto la modifica della password per il tuo account. Clicca sul seguente link o incollalo nel browser per completare il processo:",
    "youDidNotRequestPassword": "Se non l'hai richiesto, ignora questa email e la tua password rimarrà invariata."
  },
  "error": {
    "deletingFile": "Si è verificato un errore durante l'eleminazione del file.",
    "emailOrPasswordIncorrect": "L'email o la password fornita non è corretta.",
    "followingFieldsInvalid_one": "Il seguente campo non è valido:",
    "followingFieldsInvalid_other": "I seguenti campi non sono validi:",
    "noFilesUploaded": "Nessun file è stato caricato.",
    "notAllowedToPerformAction": "Non sei autorizzato a eseguire questa azione.",
    "problemUploadingFile": "Si è verificato un problema durante il caricamento del file.",
    "unableToDeleteCount": "Impossibile eliminare {{count}} su {{total}} {{label}}.",
    "unableToUpdateCount": "Impossibile aggiornare {{count}} su {{total}} {{label}}.",
    "unauthorized": "Non autorizzato, devi essere loggato per effettuare questa richiesta.",
    "userLocked": "Questo utente è bloccato a causa di troppi tentativi di accesso non riusciti."
  },
  "general": {
    "deletedCountSuccessfully": "{{count}} {{label}} eliminato con successo.",
    "deletedSuccessfully": "Eliminato con successo.",
    "notFound": "Non Trovato",
    "successfullyCreated": "{{label}} creato con successo.",
    "updatedCountSuccessfully": "{{count}} {{label}} aggiornato con successo.",
    "value": "Valore"
  },
  "validation": {
    "emailAddress": "Si prega di inserire un indirizzo email valido.",
    "enterNumber": "Si prega di inserire un numero valido.",
    "greaterThanMax": "{{value}} è superiore al massimo consentito {{label}} di {{max}}.",
    "invalidInput": "Questo campo ha un input non valido.",
    "invalidSelection": "Questo campo ha una selezione non valida.",
    "invalidSelections": "'In questo campo sono presenti le seguenti selezioni non valide:'",
    "lessThanMin": "{{value}} è inferiore al minimo consentito {{label}} di {{min}}.",
    "longerThanMin": "Questo valore deve essere più lungo della lunghezza minima di {{minLength}} caratteri.",
    "notValidDate": "\"{{value}}\" non è una data valida.",
    "requiresNoMoreThan": "Questo campo richiede non più di {{count}} {{label}}.",
    "requiresTwoNumbers": "Questo campo richiede due numeri.",
    "shorterThanMax": "Questo valore deve essere inferiore alla lunghezza massima di {{maxLength}} caratteri.",
    "trueOrFalse": "Questo campo può essere solo uguale a 'true' o 'false'.",
    "validUploadID": "'Questo campo non è un ID di Upload valido.'"
  },
  "version": {
    "autosavedSuccessfully": "Salvataggio automatico riuscito.",
    "draftSavedSuccessfully": "Bozza salvata con successo.",
    "restoredSuccessfully": "Ripristinato con successo."
  }
}