{
  "$schema": "./translation-schema.json",
  "authentication": {
    "newAccountCreated": "<a href=\"{{serverURL}}\">{{serverURL}}</a> သို့ဝင်ရောက်ရန် သင့်အီးမေးလ်ကို အတည်ပြုရန်အတွက် အကောင့်အသစ်တစ်ခုကို ယခုလေးတင် ဖန်တီးပြီးပါပြီ။ ကျေးဇူးပြု၍ အောက်ပါလင့်ခ်ကို နှိပ်ပါ သို့မဟုတ် သင့်အီးမေးလ်ကို အတည်ပြုရန် ဖော်ပြပါ လင့်ခ်ကို သင့်ဘရောက်ဆာထဲသို့ ကူးထည့်ပါ- <a href=\"{{verificationURL}}\">{{verificationURL}}</a><br> သင့်အီးမေးလ်ကို အတည်ပြုပြီးနောက်၊ သင်သည် အောင်မြင်စွာ လော့ဂ်အင်ဝင်နိုင်ပါမည်။",
    "resetYourPassword": "သင့်စကားဝှက်ကို ပြန်လည်သတ်မှတ်ပါ။",
    "verifyYourEmail": "သင့်အီးမေးလ်ကို အတည်ပြုပါ။",
    "youAreReceivingResetPassword": "သင့်အကောင့်အတွက် စကားဝှက်ကို ပြန်လည်သတ်မှတ်ရန် သင် (သို့မဟုတ် အခြားသူတစ်ဦးဦး) က တောင်းဆိုထားသောကြောင့်လက်ခံရရှိခြင်းဖြစ်သည်။ ကျေးဇူးပြု၍ အောက်ပါလင့်ခ်ကို နှိပ်ပါ (သို့မဟုတ်) ၎င်းကို သင့်ဘရောက်ဆာထဲသို့ ကူးထည့်ပါ။",
    "youDidNotRequestPassword": "ယခု လုပ်ဆောင်ချက်ကို သင်မတောင်းဆိုထားပါက ဤအီးမေးလ်ကို လျစ်လျူရှုထားခြင်းဖြင့် သင့်စကားဝှက်သည် ပြောင်းလဲမည်မဟုတ်ပါ။"
  },
  "error": {
    "deletingFile": "ဖိုင်ကိုဖျက်ရာတွင် အမှားအယွင်းရှိနေသည်။",
    "emailOrPasswordIncorrect": "ထည့်သွင်းထားသော အီးမေးလ် သို့မဟုတ် စကားဝှက်သည် မမှန်ပါ။",
    "followingFieldsInvalid_one": "ထည့်သွင်းထားသော အချက်အလက်သည် မမှန်ကန်ပါ။",
    "followingFieldsInvalid_other": "ထည့်သွင်းထားသော အချက်အလက်များသည် မမှန်ကန်ပါ။",
    "noFilesUploaded": "ဖိုင်များကို အပ်လုဒ်လုပ်ထားခြင်းမရှိပါ။",
    "notAllowedToPerformAction": "ဤလုပ်ဆောင်ချက်ကို လုပ်ဆောင်ရန် ခွင့်မပြုပါ။",
    "problemUploadingFile": "ဖိုင်ကို အပ်လုဒ်တင်ရာတွင် ပြဿနာရှိနေသည်။",
    "unableToDeleteCount": "{{total}} {{label}} မှ {{count}} ကို ဖျက်၍မရပါ။",
    "unableToUpdateCount": "{{total}} {{label}} မှ {{count}} ကို အပ်ဒိတ်လုပ်၍မရပါ။",
    "unauthorized": "အခွင့်မရှိပါ။ ဤတောင်းဆိုချက်ကို လုပ်ဆောင်နိုင်ရန် သင်သည် လော့ဂ်အင်ဝင်ရပါမည်။",
    "userLocked": "အကောင့်ထဲကို ဝင်ရန် အရမ်းအရမ်းကို ကြိုးပမ်းနေသောကြောင့် အကောင့်အား လော့ခ်ချလိုက်ပါသည်။"
  },
  "general": {
    "deletedCountSuccessfully": "{{count}} {{label}} ကို အောင်မြင်စွာ ဖျက်လိုက်ပါပြီ။",
    "deletedSuccessfully": "အောင်မြင်စွာ ဖျက်လိုက်ပါပြီ။",
    "notFound": "ဘာမှ မရှိတော့ဘူး။",
    "successfullyCreated": "{{label}} အောင်မြင်စွာဖန်တီးခဲ့သည်။",
    "updatedCountSuccessfully": "{{count}} {{label}} ကို အောင်မြင်စွာ အပ်ဒိတ်လုပ်ခဲ့သည်။",
    "value": "တန်ဖိုး"
  },
  "validation": {
    "emailAddress": "မှန်ကန်သော အီးမေးလ်လိပ်စာကို ထည့်သွင်းပါ။",
    "enterNumber": "မှန်ကန်သောနံပါတ်တစ်ခုထည့်ပါ။",
    "greaterThanMax": "{{value}} သည် {{max}} ထက် ပိုမိုကြီးသည်။ ဤသည်ဖြင့် {{label}} အများဆုံးခွင့်ပြုထားသော တန်ဖိုးထက် ကြီးသည်။",
    "invalidInput": "ဤအကွက်တွင် မမှန်ကန်သော ထည့်သွင်းမှုတစ်ခုရှိသည်။",
    "invalidSelection": "ဤအကွက်တွင် မမှန်ကန်သော ရွေးချယ်မှုတစ်ခုရှိသည်။",
    "invalidSelections": "ဤအကွက်တွင် အောက်ပါ မမှန်ကန်သော ရွေးချယ်မှုများ ရှိသည်",
    "lessThanMin": "{{value}} သည် {{min}} ထက် ပိုမိုနိမ့်သည်။ ဤသည်ဖြင့် {{label}} အနည်းဆုံးခွင့်ပြုထားသော တန်ဖိုးထက် နိမ့်သည်။",
    "longerThanMin": "ဤတန်ဖိုးသည် အနိမ့်ဆုံးအရှည် {{minLength}} စာလုံးထက် ပိုရှည်ရမည်။",
    "notValidDate": "\"{{value}}\" သည် တရားဝင်ရက်စွဲမဟုတ်ပါ။",
    "requiresNoMoreThan": "ဤအကွက်တွင် {{count}} {{label}} ထက် မပိုရပါ။",
    "requiresTwoNumbers": "ဤအကွက်သည် နံပါတ်နှစ်ခု လိုအပ်ပါသည်။",
    "shorterThanMax": "ဤတန်ဖိုးသည် စာလုံး {{maxLength}} လုံး၏ အမြင့်ဆုံးအရှည်ထက် ပိုတိုရပါမည်။",
    "trueOrFalse": "ဤအကွက်သည် တစ်ခုခုဖြစ်ရပါမည်။",
    "validUploadID": "'ဤအကွက်သည် မှန်ကန်သော အပ်လုဒ် ID မဟုတ်ပါ။'"
  },
  "version": {
    "autosavedSuccessfully": "အလိုအလျောက် သိမ်းဆည်းပြီးပါပြီ။",
    "draftSavedSuccessfully": "မူကြမ်းကို အောင်မြင်စွာ သိမ်းဆည်းပြီးပါပြီ။",
    "restoredSuccessfully": "အောင်မြင်စွာ ပြန်လည်ရယူခဲ့သည်။"
  }
}