{
  "$schema": "./translation-schema.json",
  "authentication": {
    "newAccountCreated": "تمّ إنشاء حساب جديد لتتمكّن من الوصول إلى <a href=\"{{serverURL}}\"> {{serverURL}} </a> الرّجاء النّقر فوق الرّابط التّالي أو لصق عنوان URL أدناه في متصفّحّك لتأكيد بريدك الإلكتروني : <a href=\"{{verificationURL}}\"> {{verificationURL}} </a> <br> بعد التّحقّق من بريدك الإلكتروني ، ستتمكّن من تسجيل الدّخول بنجاح.",
    "resetYourPassword": "إعادة تعيين كلمة المرور الخاصّة بك",
    "verifyYourEmail": "قم بتأكيد بريدك الألكتروني",
    "youAreReceivingResetPassword": "أنت تتلقّى هذا البريد الالكتروني لأنّك (أو لأنّ شخص آخر) طلبت إعادة تعيين كلمة المرور لحسابك. الرّجاء النّقر فوق الرّابط التّالي ، أو لصق هذا الرّابط في متصفّحك لإكمال العمليّة:",
    "youDidNotRequestPassword": "إن لم تطلب هذا ، يرجى تجاهل هذا البريد الإلكتروني وستبقى كلمة مرورك ذاتها بدون تغيير."
  },
  "error": {
    "deletingFile": "حدث خطأ أثناء حذف الملف.",
    "emailOrPasswordIncorrect": "البريد الإلكتروني أو كلمة المرور المقدمة غير صحيحة.",
    "followingFieldsInvalid_one": "الحقل التالي غير صالح:",
    "followingFieldsInvalid_other": "الحقول التالية غير صالحة:",
    "noFilesUploaded": "لم يتمّ رفع أيّة ملفّات.",
    "notAllowedToPerformAction": "لا يسمح لك القيام بهذه العمليّة.",
    "problemUploadingFile": "حدث خطأ اثناء رفع الملفّ.",
    "unableToDeleteCount": "يتعذّر حذف {{count}} من {{total}} {{label}}.",
    "unableToUpdateCount": "يتعذّر تحديث {{count}} من {{total}} {{label}}.",
    "unauthorized": "غير مصرّح لك ، عليك أن تقوم بتسجيل الدّخول لتتمكّن من تقديم هذا الطّلب.",
    "userLocked": "تمّ قفل هذا المستخدم نظرًا لوجود عدد كبير من محاولات تسجيل الدّخول الغير ناجحة."
  },
  "general": {
    "deletedCountSuccessfully": "تمّ حذف {{count}} {{label}} بنجاح.",
    "deletedSuccessfully": "تمّ الحذف بنجاح.",
    "notFound": "غير موجود",
    "successfullyCreated": "{{label}} تم إنشاؤها بنجاح.",
    "updatedCountSuccessfully": "تم تحديث {{count}} {{label}} بنجاح.",
    "value": "القيمة"
  },
  "validation": {
    "emailAddress": "يرجى إدخال عنوان بريد إلكتروني صحيح.",
    "enterNumber": "يرجى إدخال رقم صحيح.",
    "greaterThanMax": "{{value}} أكبر من الحد الأقصى المسموح به {{label}} الذي يبلغ {{max}}.",
    "invalidInput": "هذا الحقل لديه إدخال غير صالح.",
    "invalidSelection": "هذا الحقل لديه اختيار غير صالح.",
    "invalidSelections": "هذا الحقل لديه الاختيارات الغير صالحة التالية:",
    "lessThanMin": "{{value}} أقل من الحد الأدنى المسموح به {{label}} الذي يبلغ {{min}}.",
    "longerThanMin": "يجب أن يكون هذا القيمة أطول من الحد الأدنى للطول الذي هو {{minLength}} أحرف.",
    "notValidDate": "\"{{value}}\" ليس تاريخا صالحا.",
    "requiresNoMoreThan": "هذا الحقل يتطلب عدم تجاوز {{count}} {{label}}.",
    "requiresTwoNumbers": "هذا الحقل يتطلب رقمين.",
    "shorterThanMax": "يجب أن تكون هذه القيمة أقصر من الحد الأقصى للطول الذي هو {{maxLength}} أحرف.",
    "trueOrFalse": "يمكن أن يكون هذا الحقل مساويًا فقط للقيمتين صحيح أو خطأ.",
    "validUploadID": "هذا الحقل ليس معرّف تحميل صالح."
  },
  "version": {
    "autosavedSuccessfully": "تمّ الحفظ التّلقائي بنجاح.",
    "draftSavedSuccessfully": "تمّ حفظ المسودّة بنجاح.",
    "restoredSuccessfully": "تمّت الاستعادة بنحاح."
  }
}