{
  "$schema": "./translation-schema.json",
  "authentication": {
    "newAccountCreated": "یک نمایه کاربری تازه برای دسترسی شما ساخته شده است <a href=\"{{serverURL}}\">{{serverURL}}</a> لطفاً روی پیوند زیر کلیک کنید یا آدرس زیر را در مرورگر خود قرار دهید تا رایانامه خود را تأیید کنید: <a href=\"{{verificationURL}}\">{{verificationURL}}</a><br> پس از تایید رایانامه خود، می توانید وارد سیستم شوید.",
    "resetYourPassword": "گذرواژه خود را بازنشانی کنید",
    "verifyYourEmail": "رایانامه خود را تأیید کنید",
    "youAreReceivingResetPassword": "درخواست بازنشانی گذرواژه نمایه توسط شما یا فرد دیگری فرستاده شده است، اگر این درخواست از سمت شما بوده روی پیوند مقابل کلیک کنید یا در مرورگر وب خود پیوند را کپی کنید تا مراحل بازنشانی گذرواژه تکمیل شود، در غیر این صورت جای نگرانی نیست این پیام را نادیده بگیرید:",
    "youDidNotRequestPassword": "اگر شما این درخواست را ندادید، لطفاً این رایانامه را نادیده بگیرید و گذرواژه شما تغییری نخواهد کرد."
  },
  "error": {
    "deletingFile": "هنگام حذف فایل خطایی روی داد.",
    "emailOrPasswordIncorrect": "رایانامه یا گذرواژه ارائه شده نادرست است.",
    "followingFieldsInvalid_one": "کادر زیر نامعتبر است:",
    "followingFieldsInvalid_other": "کادرهای زیر نامعتبر هستند:",
    "noFilesUploaded": "هیچ رسانه‌ای بارگذاری نشده.",
    "notAllowedToPerformAction": "این عملیات برای شما مجاز نیست.",
    "problemUploadingFile": "هنگام بارگذاری سند خطایی رخ داد.",
    "unableToDeleteCount": "نمی‌توان {{count}} از {{total}} {{label}} را حذف کرد.",
    "unableToUpdateCount": "امکان به روز رسانی {{count}} خارج از {{total}} {{label}} وجود ندارد.",
    "unauthorized": "درخواست نامعتبر، جهت فرستادن این درخواست باید وارد شوید.",
    "userLocked": "این کاربر به دلیل تلاش های زیاد برای ورود ناموفق قفل شده است."
  },
  "general": {
    "deletedCountSuccessfully": "تعداد {{count}} {{label}} با موفقیت پاک گردید.",
    "deletedSuccessfully": "با موفقیت حذف شد.",
    "notFound": "یافت نشد",
    "successfullyCreated": "{{label}} با موفقیت ساخته شد.",
    "updatedCountSuccessfully": "تعداد {{count}} با عنوان {{label}} با موفقیت بروزرسانی شدند.",
    "value": "مقدار"
  },
  "validation": {
    "emailAddress": "لطفاً یک نشانی رایانامه معتبر وارد کنید.",
    "enterNumber": "لطفاً یک شماره درست وارد کنید.",
    "greaterThanMax": "{{value}} بیشتر از حداکثر مجاز برای {{label}} است که {{max}} است.",
    "invalidInput": "این کادر دارای ورودی نامعتبر است.",
    "invalidSelection": "این کادر دارای یک انتخاب نامعتبر است.",
    "invalidSelections": "این کادر دارای انتخاب‌های نامعتبر زیر است:",
    "lessThanMin": "{{value}} کمتر از حداقل مجاز برای {{label}} است که {{min}} است.",
    "longerThanMin": "ورودی باید بیش از حداقل {{minLength}} واژه باشد.",
    "notValidDate": "\"{{value}}\" یک تاریخ معتبر نیست.",
    "requiresNoMoreThan": "این رشته به بیش از {{count}} {{label}} نیاز دارد.",
    "requiresTwoNumbers": "این کادر به دو عدد نیاز دارد.",
    "shorterThanMax": "ورودی باید کمتر از {{maxLength}} واژه باشد.",
    "trueOrFalse": "این کادر فقط می تواند به صورت true یا false باشد.",
    "validUploadID": "این فیلد یک شناسه بارگذاری معتبر نیست."
  },
  "version": {
    "autosavedSuccessfully": "با موفقیت ذخیره خودکار شد.",
    "draftSavedSuccessfully": "پیش‌نویس با موفقیت ذخیره شد.",
    "restoredSuccessfully": "با موفقیت بازیابی شد."
  }
}